{
  "width": 1080,
  "height": 1920,
  "fps": 24,
  "duration_sec": 8,
  "plate": "plate.png",
  "matte": "matte/fg",
  "background": "#EFE6DA",
  "layers": [
    {
      "id": "ring",
      "text": "PINK",
      "split": "letter",
      "font": {
        "family": "Playfair Display",
        "weight": 700,
        "size": 260,
        "tracking": 0.02
      },
      "color": "#C9748A",
      "material": "extruded",
      "depth": 16,
      "from": 0,
      "to": 5,
      "anchor": {
        "x": 0.5,
        "y": 0.5
      },
      "preset": "orbit-behind-product",
      "preset_params": {
        "ring": {
          "radius": 420,
          "tilt": 12,
          "arc": 360,
          "face": "camera"
        }
      }
    },
    {
      "id": "tagline",
      "text": "PINK YOUR LIFE",
      "split": "letter",
      "font": {
        "family": "Playfair Display",
        "weight": 600,
        "size": 92,
        "tracking": 0.08
      },
      "color": "#3A2228",
      "material": "shadow",
      "plane": "front",
      "from": 4.6,
      "to": 8,
      "anchor": {
        "x": 0.5,
        "y": 0.17
      },
      "max_width": 0.86,
      "preset": "assemble-tagline"
    },
    {
      "id": "brand-3d",
      "text": "ROSÉ",
      "split": "letter",
      "engine": "three",
      "font": {
        "family": "Playfair Display",
        "three_font": "playfair_bold",
        "size": 150
      },
      "color": "#C9748A",
      "material": "extruded",
      "depth": 30,
      "plane": "front",
      "from": 5.2,
      "to": 8,
      "anchor": {
        "x": 0.5,
        "y": 0.86
      },
      "preset": "drop-with-gravity",
      "shadow_catcher": true
    },
    {
      "id": "draw-sparkle",
      "type": "draw",
      "text": "",
      "font": {
        "family": "Playfair Display",
        "size": 1
      },
      "shape": "sparkle",
      "size": 130,
      "stroke": "#FFFFFF",
      "stroke_width": 6,
      "boil": 1.6,
      "from": 1.0,
      "to": 4.5,
      "anchor": {
        "x": 0.74,
        "y": 0.33
      },
      "preset": "draw-on-off"
    },
    {
      "id": "draw-circle",
      "type": "draw",
      "text": "",
      "font": {
        "family": "Playfair Display",
        "size": 1
      },
      "shape": "circle",
      "size": 560,
      "stroke": "#FFFFFF",
      "stroke_width": 5,
      "boil": 1.6,
      "from": 1.5,
      "to": 5,
      "anchor": {
        "x": 0.5,
        "y": 0.5
      },
      "plane": "back",
      "preset": "draw-on-off"
    },
    {
      "id": "draw-underline",
      "type": "draw",
      "text": "",
      "font": {
        "family": "Playfair Display",
        "size": 1
      },
      "shape": "underline",
      "size": 640,
      "stroke": "#3A2228",
      "stroke_width": 5,
      "boil": 1.4,
      "from": 5.6,
      "to": 8,
      "anchor": {
        "x": 0.5,
        "y": 0.205
      },
      "preset": "draw-on"
    }
  ],
  "grain": {
    "amount": 0.14,
    "size": 0.9
  }
}